{
  "version": 1,
  "tuning": {
    "seed": 265443,
    "trait_affinity": 2,
    "initial_confidence": 50,
    "initial_resolve": 50,
    "confidence_step": 2,
    "reaction_interval": 4,
    "story_rest_visits": 2,
    "story_min_visits": 2,
    "setback_after": 3,
    "setback_margin": 3,
    "nemesis_after": 2,
    "familiar_after": 3,
    "missing_partner_visits": 5,
    "story_max_visits": 8,
    "story_setbacks_limit": 3
  },
  "event_groups": {
    "1": "good",
    "29": "good",
    "2": "bad",
    "3": "bad",
    "4": "bad",
    "8": "bad",
    "9": "bad",
    "20": "bad",
    "24": "bad",
    "30": "bad",
    "35": "bad",
    "36": "bad",
    "65": "bad",
    "12": "hazard",
    "13": "hazard",
    "11": "scenery",
    "28": "scenery",
    "39": "scenery",
    "21": "delay",
    "10": "needs",
    "14": "needs",
    "15": "needs",
    "26": "needs",
    "18": "comfort",
    "25": "comfort",
    "27": "comfort",
    "6": "strategy",
    "16": "strategy",
    "17": "strategy",
    "32": "strategy",
    "33": "strategy",
    "55": "strategy",
    "56": "strategy",
    "57": "strategy",
    "58": "strategy",
    "59": "strategy",
    "60": "strategy",
    "22": "social",
    "51": "practice",
    "52": "practice",
    "53": "practice",
    "54": "practice"
  },
  "personalities": [
    {
      "id": "gambler",
      "name": "The Gambler",
      "trait_mask": 14,
      "reactions": {
        "good": 0,
        "bad": 0,
        "hazard": 1,
        "scenery": 0,
        "delay": 0,
        "needs": 0,
        "comfort": 0,
        "strategy": 1,
        "social": 0,
        "practice": 0,
        "arrival": 0,
        "return": 0
      },
      "story_weights": [
        12,
        1,
        1,
        1,
        1,
        1,
        8,
        1,
        1,
        1,
        1,
        5
      ],
      "lines": {
        "good": [
          "Worth the risk.",
          "That is why I went for it.",
          "Safe shots never felt like that."
        ],
        "bad": [
          "The odds were excellent yesterday.",
          "A calculated disaster.",
          "Double or nothing on the next one."
        ],
        "hazard": [
          "That water is mostly psychological.",
          "One yard short of genius.",
          "I knew the stakes."
        ],
        "scenery": [
          "Lovely view from the dangerous route.",
          "That gap is practically an invitation.",
          "Beautiful place to take a chance."
        ],
        "delay": [
          "I could try the shortcut while waiting.",
          "All this waiting is bad for my nerve.",
          "Let us raise the stakes, not the queue."
        ],
        "needs": [
          "A snack before the next gamble.",
          "Thirst is an avoidable hazard.",
          "I would wager there is food nearby."
        ],
        "comfort": [
          "Small comforts, enormous ambitions.",
          "A good drink steadies the nerve.",
          "Excellent. Back to taking chances."
        ],
        "strategy": [
          "Safe route or a story to tell?",
          "I can carry that. Probably.",
          "Fortune favors the second attempt."
        ],
        "social": [
          "{partner}, fancy making this interesting?",
          "I promise the wager is imaginary.",
          "Your safe route, my shortcut."
        ],
        "practice": [
          "Practicing the shot everyone calls foolish.",
          "Making my own luck today.",
          "Even gamblers should learn the odds."
        ],
        "arrival": [
          "New course, fresh possibilities.",
          "Let us find the ambitious route.",
          "I brought my optimistic ball supply."
        ],
        "return": [
          "Back for another roll of the dice.",
          "I remember where the bold route starts.",
          "Visit {visit}. This feels lucky."
        ]
      }
    },
    {
      "id": "purist",
      "name": "The Purist",
      "trait_mask": 1,
      "reactions": {
        "good": 0,
        "bad": 0,
        "hazard": 0,
        "scenery": 0,
        "delay": -1,
        "needs": 0,
        "comfort": 0,
        "strategy": 1,
        "social": 0,
        "practice": 0,
        "arrival": 0,
        "return": 0
      },
      "story_weights": [
        1,
        1,
        1,
        1,
        8,
        1,
        12,
        1,
        1,
        1,
        5,
        1
      ],
      "lines": {
        "good": [
          "A properly earned result.",
          "That was an honest golf shot.",
          "Good design rewards good judgment."
        ],
        "bad": [
          "No excuse. A poor execution.",
          "The hole asked a fair question.",
          "I owe that shot another attempt."
        ],
        "hazard": [
          "A hazard with a purpose, I hope.",
          "I chose the wrong side.",
          "Good golf includes consequences."
        ],
        "scenery": [
          "The land does the talking here.",
          "An understated pleasure.",
          "A good hole needs little decoration."
        ],
        "delay": [
          "Etiquette would help this queue.",
          "A round should have a rhythm.",
          "We seem to have misplaced the pace."
        ],
        "needs": [
          "Simple refreshments would suffice.",
          "A bench is a sound investment.",
          "Even traditionalists need lunch."
        ],
        "comfort": [
          "Quiet comfort. Nicely judged.",
          "A modest pleasure, well provided.",
          "Exactly what a clubhouse should offer."
        ],
        "strategy": [
          "Position matters more than spectacle.",
          "There is a proper angle into this green.",
          "A fair choice between courage and restraint."
        ],
        "social": [
          "A pleasure to share a proper round.",
          "After you, {partner}.",
          "Good company improves a good course."
        ],
        "practice": [
          "Fundamentals first, equipment second.",
          "Working on the ordinary shots.",
          "A dependable swing earns its keep."
        ],
        "arrival": [
          "Let us see what the layout asks.",
          "I hope the golf speaks for itself.",
          "A new course deserves a fair hearing."
        ],
        "return": [
          "Back to see the course afresh.",
          "I remember the questions this layout asks.",
          "Familiar ground, another honest round."
        ]
      }
    },
    {
      "id": "social",
      "name": "The Social Butterfly",
      "trait_mask": 26,
      "reactions": {
        "good": 0,
        "bad": 0,
        "hazard": 0,
        "scenery": 0,
        "delay": 0,
        "needs": 0,
        "comfort": 1,
        "strategy": 0,
        "social": 1,
        "practice": 0,
        "arrival": 0,
        "return": 0
      },
      "story_weights": [
        1,
        1,
        12,
        1,
        1,
        1,
        1,
        1,
        8,
        1,
        5,
        1
      ],
      "lines": {
        "good": [
          "Did you see that, {partner}?",
          "A moment worth sharing.",
          "Now we have something to talk about."
        ],
        "bad": [
          "At least nobody missed the conversation.",
          "I was halfway through a good story.",
          "Please remember the joke, not the shot."
        ],
        "hazard": [
          "That ball is making new friends.",
          "A splash breaks the ice.",
          "{partner}, tell me you have done that too."
        ],
        "scenery": [
          "We should bring everyone here.",
          "A perfect place for a good chat.",
          "The scenery deserves an audience."
        ],
        "delay": [
          "Time to learn everyone in the queue.",
          "Anyone know the group ahead?",
          "We could start a book club at this tee."
        ],
        "needs": [
          "Anyone joining me for a snack?",
          "A conversation needs refreshments.",
          "Let us find somewhere to sit together."
        ],
        "comfort": [
          "The best part is the company.",
          "A lovely spot to catch up.",
          "Stay a minute, {partner}."
        ],
        "strategy": [
          "Talk me through your plan.",
          "Your idea or my adventurous idea?",
          "Two minds, several questionable options."
        ],
        "social": [
          "So, how has your week been?",
          "Good to meet another familiar face.",
          "We should arrange another round."
        ],
        "practice": [
          "Practice is better with company.",
          "Watch this and tell me what you think.",
          "A little advice, {partner}?"
        ],
        "arrival": [
          "Who will we meet today?",
          "New course, new company.",
          "I hope there is a friendly welcome."
        ],
        "return": [
          "Good to see this place again.",
          "Another chance to catch up.",
          "Visit {visit}, and still more stories."
        ]
      }
    },
    {
      "id": "speedster",
      "name": "The Speedster",
      "trait_mask": 4,
      "reactions": {
        "good": 0,
        "bad": 0,
        "hazard": 0,
        "scenery": 0,
        "delay": -1,
        "needs": 0,
        "comfort": -1,
        "strategy": 0,
        "social": 0,
        "practice": 0,
        "arrival": 0,
        "return": 0
      },
      "story_weights": [
        1,
        1,
        1,
        1,
        1,
        1,
        8,
        12,
        1,
        5,
        1,
        1
      ],
      "lines": {
        "good": [
          "Lovely. Next tee.",
          "Good shot, keep moving.",
          "That saved a little time."
        ],
        "bad": [
          "No time to dwell on it.",
          "Quick recovery, then onward.",
          "That cost a shot and a minute."
        ],
        "hazard": [
          "Drop, recover, keep going.",